period_end_timestamp,consolidated_news_summary,consolidated_risk_score_for_period,consolidated_risk_justification_for_period,Technology_period_risk_score,Technology_period_justification,Finance_period_risk_score,Finance_period_justification,Healthcare_period_risk_score,Healthcare_period_justification,Energy_period_risk_score,Energy_period_justification,Manufacturing_period_risk_score,Manufacturing_period_justification,Transportation_period_risk_score,Transportation_period_justification,Retail_period_risk_score,Retail_period_justification,Telecommunications_period_risk_score,Telecommunications_period_justification,Real_Estate_period_risk_score,Real_Estate_period_justification,Agriculture_period_risk_score,Agriculture_period_justification
2025-08-05 18:00:00+00:00,"This period presents a moderate risk due to a critical delay in a key JPMorgan Chase financial report, potentially impacting investor confidence and operational continuity across multiple industries. The simultaneous exposure across technology, finance, healthcare, energy, and manufacturing underscores a need for proactive monitoring and contingency planning.",7.0,"The news indicates a significant potential delay in JPMorgan Chase’s 10-Q filing, particularly concerning the f...",5.0,"The delay to the 10-Q filing raises concerns about the potential impact of the report on the company's ability to maintain a competitive edge, particularly given the reliance on this information for investor assessments and regulatory compliance.",8.0,"A delayed 10-Q filing directly threatens JPMorgan Chase's financial stability, jeopardizing its ability to effectively manage its operations, conduct risk assessment, and fulfill regulatory obligations.  This could lead to market volatility and reputational damage.",3.0,"While not a crisis, a delay in the 10-Q filing carries a moderate risk to a company's ability to maintain operational efficiency and potential patient care. Supply chain disruptions, product development, and regulatory hurdles necessitate careful attention to this risk.",2.0,"The news is linked to a 10-Q filing, increasing the risk of potential operational disruptions, impacting financial forecasts, and affecting supply chains, requiring vigilance and mitigation strategies.",3.0,"A delay in the 10-Q filing could significantly disrupt manufacturing processes, supply chains, and production schedules, potentially leading to production bottlenecks, lost revenue, and customer dissatisfaction.",2.0,"A 10-Q filing delay could affect transportation logistics, schedules, and operational efficiency, necessitating a conservative approach to risk management and potential delays in deliveries.",2.0,"A delay in the 10-Q filing could negatively impact retail operations, consumer engagement, and sales forecasting, requiring adjustments to marketing and inventory strategies.",2.0,"A delay in the 10-Q filing risks affecting network performance, service delivery, and customer relationships, demanding rigorous monitoring and potential intervention to mitigate the risk.",1.0,"While not a crisis, a delay in the 10-Q filing has a minimal impact, but could affect the value of real estate holdings, as this impacts investment strategies and valuations. A careful assessment of potential risks is warranted.",1.0,"While not a direct filing impact, a delay could disrupt agricultural yields, market prices, and supply chains, increasing the risk of financial losses and economic instability for farmers and related industries."
2025-08-12 18:00:00+00:00,"JPMorgan Chase's CFO presentation on Tuesday, September 12, 2023, at 10:30 AM Eastern Time is a key event with moderate potential for market reaction and increased scrutiny. This presentation will primarily impact the technology, finance, and healthcare sectors, warranting closer monitoring of the webcast's technical performance and potential reputational consequences.",7.0,"The announcement of a significant CFO presentation by JPMorgan Chase, particularly with implications for financial strategy, coupled with the broader economic context of a recessionary period, signals a moderate risk profile. While the webcast itself isn't a high-impact event, the potential for technical issues, competitive pressures and media coverage, especially regarding the company’s financial performance, increase the potential for negative market reactions and associated risks across multiple sectors. The energy sector’s low risk assessment doesn't significantly counterbalance the heightened potential for risks in the technology, finance, and healthcare sectors.",6.0,"Moderate.  The announcement highlights a critical strategic shift, increasing the potential for security vulnerabilities and disruption due to the webcast’s reliance on a live audio platform.  Competition within the technology sector is also intensifying, increasing the risk of market volatility.",8.0,"High.  A CFO presentation, particularly one involving strategic financial decisions, carries a high risk of market volatility and reputational damage, particularly due to the potential for financial missteps or misinterpretation of the presentation.",1.0,"Low.  The announcement is unrelated to the healthcare sector.  It’s a corporate event focused on financial matters, with limited potential for disrupting existing operations or impacting patient outcomes.",1.0,"Low.  The announcement isn’t tied to the energy sector.  It’s a corporate event focused on financial matters, with limited potential for disrupting existing operations or impacting patient outcomes.",1.0,"Low. The announcement is not a manufacturing-related event. It’s a corporate event focused on financial matters, with limited potential for disrupting existing operations or impacting patient outcomes.",1.0,"Low.  The announcement is not a transportation industry event. It’s a corporate event focused on financial matters, with limited potential for disrupting existing operations or impacting patient outcomes.",1.0,"Low. The announcement is not a retail industry event. It’s a corporate event focused on financial matters, with limited potential for disrupting existing operations or impacting patient outcomes.",2.0,"Moderate. The announcement could negatively impact investor sentiment towards a major telecom provider, potentially affecting stock prices due to increased uncertainty about the company's financial health and future strategies, especially in a times of increasing market volatility.",1.0,"Low. The announcement isn't related to real estate.  It’s a corporate event focused on financial matters, with limited potential for disrupting existing operations or impacting patient outcomes.",1.0,"Low.  The announcement isn’t related to agriculture.  It’s a corporate event focused on financial matters, with limited potential for disrupting existing operations or impacting patient outcomes."
2025-08-15 18:00:00+00:00,"JPMorgan Chase announced quarterly preferred stock dividend payments to its shareholders, a routine financial event with minimal potential for immediate disruption. The announcement confirms ongoing financial stability within the company. The focus is on distribution, not significant operational risk.",4.0,"The news highlights a routine financial announcement regarding preferred stock dividends, indicating a relatively low-risk scenario. While prudent, the context isn't immediately alarming, suggesting a stable and manageable period.",5.0,"Despite the overarching low risk profile, the focus on preferred stock dividends introduces a potential for algorithm-related issues or market sentiment shifts impacting the stock price, requiring monitoring.  The routine nature of the announcement mitigates immediate crisis potential, but ongoing monitoring is crucial to assess long-term impact.",8.0,"The announcement of dividends is consistent with standard financial reporting.  However, the magnitude of the dividends (multiple series) warrants attention as a potential indicator of overall financial health, requiring close watch on JPMorgan’s financial statements. It's a generally low-risk scenario, but a deeper dive into JPMorgan’s financial projections is warranted.",3.0,"While dividends are a routine event, the specific nature of preferred stock dividends, potentially influencing market valuations, necessitates monitoring for potential market volatility impacting healthcare related stocks.  The news doesn’t introduce any significant healthcare-related risks.",2.0,"The news is entirely focused on financial distribution, lacking any indicators of operational risk or economic instability in the energy sector.  The context of dividends within a financial market does not warrant significant risk assessment.",1.0,"No specific risk signal related to manufacturing is present in this news, making it a low-risk sector.",1.0,"The announcement of preferred stock dividends doesn't impact the transportation sector, presenting no immediate risks.",1.0,"The news is unrelated to retail activities, meaning no risk assessment is warranted.",1.0,The news concerning telecommunications is not relevant to this analysis.,1.0,No risk signal from real estate is present in this news.,1.0,No risk signal from agriculture is present in this news.
2025-09-15 18:00:00+00:00,"JPMorgan Chase announced a quarterly dividend declaration for its preferred stock series, primarily affecting equity-focused investors. This signals a potential shift in investor sentiment, though the immediate impact is muted. The news focuses on a routine corporate action, presenting limited volatility to the overall market.",4.0,"The announcement of quarterly cash dividends on preferred stock represents a moderate risk to the financial stability of several sectors. While it’s a relatively non-disruptive event, the potential for investor reaction, particularly in the technology and finance sectors, warrants attention. The specific nature of the dividend structure, while generally acceptable, introduces a slight element of uncertainty compared to other announcements.",6.0,"Moderate. The dividend announcement, while not a core risk driver, triggers increased market volatility within the technology sector, specifically for companies reliant on investor confidence and stock price appreciation, due to the elevated significance of preferred stock dividends.",8.0,"High. The prominent nature of the dividend announcement—particularly as it pertains to a large, established company—indicates potential for significant market reaction, especially amongst retail, transportation and manufacturing investors. The news elevates the risk to a moderate level given the event's potential to influence market psychology and volatility.",1.0,"Low. Healthcare is an inherently stable industry with minimal direct connection to dividend announcements. The announcement is unrelated to the sector, making it a negligible risk.",1.0,"Low. Energy is a generally stable industry. Dividend announcements are not a primary risk factor in this sector, so it represents a negligible risk.",1.0,"Low. Manufacturing is a broad sector. Dividend announcements are not a primary risk factor in this sector, so it represents a negligible risk.",1.0,"Low. Transportation is a generally stable sector. Dividend announcements are not a primary risk factor in this sector, so it represents a negligible risk.",1.0,Low. Retail is a complex sector and unlikely to be significantly affected by a dividend announcement. A minor event with low potential impact.,6.0,"Moderate. The preference for preferred stock dividends adds a degree of uncertainty to the telecom sector. Given the firm’s holdings and influence, this is a moderate-risk event; while not a major concern, it necessitates cautious monitoring of valuation and growth expectations. Its impact is largely tied to the entity’s financial health and future revenue projections.",1.0,"Low. Real estate is a relatively stable sector. Dividend announcements are not a primary risk factor in this sector, so it represents a negligible risk.",1.0,"Low. Agriculture is a stable sector. Dividend announcements are not a primary risk factor in this sector, so it represents a negligible risk."
2025-09-16 18:00:00+00:00,"This period saw a confluence of corporate announcements, primarily focused on JPMorgan Chase's dividend, but also included the announcement of a third-quarter earnings call for JPMorgan Chase and the ongoing activity of various industries. The overall market sentiment is currently moderately cautious, with a focus on maintaining stability amidst potential shifts in investor confidence.  The focus is on identifying potential risks stemming from the dividend announcement and maintaining expectations within established markets.",4.0,"The JPMorgan Chase dividend announcement represents a moderately elevated risk signal. While a dividend is generally positive, the significant institution involved, the substantial payout amount, and the potential impact on investor sentiment warrant careful monitoring. The rest of the news is relatively routine, and the industry risk scores are low across the board, indicating a stable, though slightly concerning, environment.",6.0,"The individual risk scores in this period are elevated, reflecting moderate risks across the tech sector. The combination of increased risk from a significant dividend announcement, while not catastrophic, necessitates vigilance regarding market reaction and potential slowdown in growth.  Increased competition and technological disruption are looming concerns, potentially impacting profitability.",7.0,"The substantial risk score associated with the JPMorgan Chase dividend announcement indicates a heightened level of uncertainty and market sensitivity. The combined signals – dividend announcement, earnings call, and general market context – create a moderately high risk profile.  Increased volatility risk is likely, particularly in sectors heavily reliant on dividends or earnings forecasts.",1.0,"The individual risk scores for this period are low. While dividends can have a minor impact, they are a relatively small event. This period is low-risk, with stable conditions across the healthcare sector.",1.0,"The individual risk scores for this period are low. The energy sector’s reliance on dividends is minimal, representing a low-risk environment, with relatively limited influence from this event.",6.0,"The moderate risk scores, coupled with the dividend announcement, suggest a moderate level of potential disruption. The company's manufacturing operations are relatively stable, but the dividend payments are an important element of the company's revenue stream, indicating a moderate risk.",2.0,The moderate risk scores highlight that this sector's exposure to dividend payments is a minor component of its operational risk. The potential for shifts in demand or economic conditions could introduce a degree of potential disruption.,2.0,"The moderate risk scores suggest that the retail industry is a relatively stable sector with minimal dividend payments.  The dividend announcement represents a potential shift in consumer behavior, but this has a low impact.",6.0,"The moderate risk scores point towards a stable, yet potentially volatile sector.  The dividend announcement is just another piece in the overall puzzle, but doesn't present a significant disruption.",,Missing justification for Real Estate.,1.0,The sector’s risk score is relatively low.  The dividend announcement would not have a significant effect.
2025-10-09 18:00:00+00:00,"JPMorgan Chase CEO Marianne Lake is presenting a strategy update to Consumer & Community Banking. This event, occurring during a stable economic period, necessitates monitoring for potential market-related impacts or shifts in the banking sector’s outlook.  The presentation's potential implications for financial markets and investor confidence warrants attention.",4.0,"The announcement focuses on a CEO presentation within a relatively stable sector – banking – presenting a strategic update. While JPMorgan Chase is a significant player, the focus on a presentation rather than a significant operational risk indicates a moderate level of concern. The overall economic climate remains stable, contributing to a relatively low-risk environment.",6.0,"The announcement signals a strategic update by a major financial institution.  While technology is generally stable, the precise details of the presentation could introduce new complexities or vulnerabilities within the company's technological infrastructure, potentially impacting operational efficiency or security.",8.0,"The presence of a CEO presentation by a bank like JPMorgan Chase is a critical point. The institution’s involvement in financial matters introduces a significant element of risk. While the sector is generally stable, increased focus on strategy can lead to shifts in market dynamics, potentially affecting profitability or investor sentiment.",3.0,"The announcement is low risk given the sector’s generally stable nature, but requires vigilance due to JPMorgan Chase's significance in this industry.  Large financial institutions often have complex healthcare-related operations that could be disrupted by strategic decisions.",2.0,"The announcement is moderately risk, given the sector's dependence on long-term trends and market volatility.  Large financial institutions might influence energy market sentiment and investment decisions, adding complexity to the overall energy landscape.",2.0,"The announcement is moderate risk, reflecting the sector’s linkage to broader economic trends. While manufacturing is generally stable, strategic shifts by financial institutions could substantially impact supply chains and market demand, demanding careful monitoring.",1.0,"The announcement is low risk, given the industry's current stability and operational characteristics. However, changes in pricing models or logistics by financial institutions could present unforeseen risks to transportation businesses.",2.0,"The announcement could influence consumer behavior, leading to shifts in retail trends. The CEO's presentation may introduce changes to branding, product offerings, or retail practices, creating potential vulnerabilities within the retail market.",1.0,"The announcement is low risk, given the industry’s stability and regulated environment.  Changes in pricing models or network access by financial institutions could create challenges to telecom businesses, however, the event is not intrinsically risky.",2.0,"The announcement could influence real estate market sentiment, with potential impacts on investment returns and property valuations.  The CEO's presentation could introduce new investment strategies, potentially impacting property market stability.",2.0,"The announcement could impact agricultural commodity prices and supply chains, necessitating careful monitoring of market trends. Changes by financial institutions in agricultural processing could disrupt global supply chains and affect farmers' earnings."
2025-10-14 06:00:00+00:00,"The period is characterized by heightened market volatility, particularly in the financial sector and energy, coupled with a looming uncertainty surrounding JPMorgan Chase's financial health, impacting multiple industries. Supply chain stability remains a concern, while heightened investment volatility is predicted to affect retail businesses. The remaining sectors show a relatively stable risk profile, demonstrating some resilience, though significant attention is needed to address the emerging uncertainties.",7.0,"The confluence of significant risks across multiple sectors – JPMorgan Chase’s lack of Q3 2025 results, elevated uncertainty in the finance industry, and moderate risks across healthcare, energy, and manufacturing – indicates a moderate level of potential disruption.  The absence of information regarding a crucial financial event signals increased vulnerability and necessitates proactive monitoring.  The Retail sector presents a moderate risk due to the potential for slower sales trends and strategic adjustments.",6.0,"The lack of preliminary financial results for JPMorgan Chase has exacerbated existing concerns about operational stability and market sentiment within the technology sector.  The industry faces a heightened risk of disruptions due to potential shifts in market trends and technological advancement, impacting consumer behaviour and investment strategies.",9.0,"The absence of Q3 2025 results for JPMorgan Chase introduces a significant risk of market volatility, a decline in stock price, and potential systemic risk to the financial system. It exposes the company to substantial volatility and liquidity challenges, demanding robust risk management strategies.",3.0,"While not a direct cause, the lack of information regarding the financial results of JPMorgan Chase introduces a level of uncertainty within the healthcare sector.  This could influence regulatory decisions and potentially impact brand reputation and market access, prompting reassessment of strategic plans.",1.0,"The absence of Q3 2025 results for JPMorgan Chase does not directly impact the energy sector. However, it creates an opportunity for delayed strategic planning and increases the risks of operational interruptions and a shift in investment choices.  Continuous monitoring of network performance and supply chain stability remains critical.",2.0,"The delayed results of JPMorgan Chase’s financial performance doesn’t represent a direct threat to manufacturing.  However, it necessitates a reevaluation of the strategic plan regarding production methods and distribution, potentially delaying necessary investments. Increased vigilance for logistical challenges and raw material pricing volatility is needed.",1.0,"The lack of Q3 2025 results for JPMorgan Chase does not directly influence the transportation sector.  Yet, it highlights the risk of operational delays, and potentially decreased market share, depending on the nature of the transportation industry.",4.0,"The delayed financial results for JPMorgan Chase might negatively impact retail sales trends, inventory management, and the brand perception of retailers.  It requires strategic reassessment of marketing and promotional strategies, influencing consumer behavior and revenue stream.",5.0,"The absence of results for JPMorgan Chase can impact network performance, price concessions and subscriber retention.  This requires continuous monitoring of network utilization and adjustments to cost structures to maintain profitability and customer satisfaction.  Potential for customer attrition and revenue decline are concerns.",2.0,"The delayed financial results may impact property valuations, investment strategies, and potentially affect the real estate market's stability.  Therefore, it necessitates monitoring of market trends and a review of investment portfolios.",1.0,"The lack of financial results for JPMorgan Chase doesn’t directly threaten agriculture.  However, it might impact crop yield forecasts and commodity market prices, demanding ongoing analysis and risk mitigation strategies.  Monitoring of crop protection programs and fertilizer availability remains important."
