id,title,link,published,source,summary,query,target_date,ticker,fetched_at
19cd1080-a43d-4393-8ed1-77d2b30d3322,"Earnings live: UnitedHealth stock falls 19%, American Airlines slides, Texas Instruments pops, Logitech edges higher",https://finance.yahoo.com/news/live/earnings-live-unitedhealth-stock-falls-19-american-airlines-slides-texas-instruments-pops-logitech-edges-higher-213941564.html,2026-01-27T21:39:41Z,yfinance,"The fourth quarter earnings season kicks into high gear this week, with Big Tech results from Microsoft, Meta, Tesla, and Apple headlining the earnings calendar.",,2026-01-28,BA,2026-01-28T00:44:30.331464
c756aee9-fdd1-3393-871c-90f1380f612a,Boeing Co (BA) Q4 2025 Earnings Call Highlights: Record Revenue and Strong Order Backlog Amid ...,https://finance.yahoo.com/news/boeing-co-ba-q4-2025-230120737.html,2026-01-27T23:01:20Z,yfinance,"Boeing Co (BA) reports its highest quarterly revenue since 2018 and a record-setting backlog, while navigating operational hurdles and cash flow challenges.",,2026-01-28,BA,2026-01-28T00:44:30.331464
7cd7a78c-fdc4-339c-94b8-2bf848985e47,Boeing’s Stepped-Up Plane Deliveries Lift Sales,https://finance.yahoo.com/news/boeing-stepped-plane-deliveries-lift-133900584.html,2026-01-27T22:06:00Z,yfinance,CEO Kelly Ortberg said customers and investors “are going to expect more from us this year.”,,2026-01-28,BA,2026-01-28T00:44:30.331464
0ba2a511-531c-3265-ac9e-cb6385f0d7e7,F5 Networks (FFIV) Tops Q1 Earnings and Revenue Estimates,https://finance.yahoo.com/news/f5-networks-ffiv-tops-q1-221502670.html,2026-01-27T22:15:02Z,yfinance,"F5 (FFIV) delivered earnings and revenue surprises of +22.21% and +8.22%, respectively, for the quarter ended December 2025. Do the numbers hold clues to what lies ahead for the stock?",,2026-01-28,RDDT,2026-01-28T00:44:30.331464
24222bc8-0699-3a5a-b735-df3eba0f9cc2,"My spouse and I make $300,000 a year but lack a firm retirement income target — how should we plan?",https://finance.yahoo.com/news/spouse-300-000-lack-firm-201418991.html,2026-01-27T20:14:18Z,yfinance,"Do you really need a firm retirement plan? How detailed does your retirement plan actually need to be? Do you still need a plan even if you plan on working during your retirement? These are some of the more interesting questions that online financial ‘experts’ and retirement guides don’t ask. Thankfully, some people have the ... My spouse and I make $300,000 a year but lack a firm retirement income target — how should we plan?",,2026-01-28,RDDT,2026-01-28T00:44:30.331464
f5564581-9bbf-3df3-99f1-ac0cb1c8a072,Why Reddit (RDDT) Shares Are Plunging Today,https://finance.yahoo.com/news/why-reddit-rddt-shares-plunging-164540894.html,2026-01-27T16:45:40Z,yfinance,Shares of online community and discussion platform Reddit (NYSE:RDDT) fell 9.3% in the morning session after Cleveland Research analyst Ross Walthall's assessment of the company's growth narrative revealed concerns about decelerating advertising revenue.,,2026-01-28,RDDT,2026-01-28T00:44:30.331464
18911c5e-7a51-3895-8fc0-2f12f41a26da,Reddit stock tumbles 9% as analyst warns of slowing growth in 2026,https://finance.yahoo.com/news/reddit-stock-tumbles-9-analyst-141122057.html,2026-01-27T14:11:22Z,yfinance,"Investing.com -- Reddit (NYSE:RDDT) stock fell 9% Tuesday after Cleveland Research analyst Ross Walthall issued cautious comments about the social media platform’s growth prospects, adding to negative sentiment around the company.",,2026-01-28,RDDT,2026-01-28T00:44:30.331464
b840dce0-3dce-3184-a78a-602d57e8333f,Deutsche Bank Raises Reddit (RDDT) PT to $285 Highlighting Strong 2026 Buy Case,https://finance.yahoo.com/news/deutsche-bank-raises-reddit-rddt-133843486.html,2026-01-27T13:38:43Z,yfinance,"Reddit Inc. (NYSE:RDDT) is one of the best US stocks to buy and hold in 2026. On January 20, Deutsche Bank analyst Benjamin Black raised its price target on Reddit to $285 from $255 while maintaining a Buy rating. Earlier on January 13, Morgan Stanley increased its price target for Reddit from $250 to $265 […]",,2026-01-28,RDDT,2026-01-28T00:44:30.331464
7aeaf4af-f08c-33df-adf8-8d5fe9695bb8,"Woman, 27, Says Boyfriend Demanded Her Bank Login To Be 'Fully Transparent' Before Engagement — 'If You Trust Me Enough to Sleep Next to Me…'",https://www.yahoo.com/lifestyle/articles/woman-27-says-boyfriend-demanded-130110681.html,2026-01-27T13:01:10Z,yfinance,"A 27-year-old woman thought her boyfriend was gearing up for a grown-up money talk when he said he wanted them to be ""fully transparent"" financially. Instead, he asked for her bank login. Not joint account planning. Not budgets. Her actual password. When she laughed in disbelief, he got serious—and then got offended when she said no. In a post on Reddit, the woman explained that she and her 30-year-old boyfriend have been living together for over two years, splitting bills fairly evenly. She ear",,2026-01-28,RDDT,2026-01-28T00:44:30.331464
379f2ae8-0dac-372a-8545-529f9b7c630a,What Makes Reddit (RDDT) an Attractive Investment Bet?,https://finance.yahoo.com/news/makes-reddit-rddt-attractive-investment-125912035.html,2026-01-27T12:59:12Z,yfinance,"NewBridge Asset Management, an investment management company, recently released its Q4 2025 letter for “NewBridge Large Cap Growth Equity Strategy”. A copy of the letter can be downloaded here. Equity markets continued their upward momentum in the fourth quarter, driven by resilient economic growth and solid corporate returns. In the fourth quarter, large-cap growth outperformed, […]",,2026-01-28,RDDT,2026-01-28T00:44:30.331464
632a9e24-262c-3b58-a006-aa713185e0df,"He Considered Pulling $8,000 From His 401(k) at 25 to Pay Off Credit Cards. Here's the Alternative He Was Weighing",https://finance.yahoo.com/news/considered-pulling-8-000-401-200107640.html,2026-01-26T20:01:07Z,yfinance,"$400 a month. That's how much a 25-year-old Reddit user said he was throwing at his credit cards, and nearly 80% of it was disappearing into interest. It was his version of being ""aggressive,"" he wrote. ""But the interest is...",,2026-01-28,RDDT,2026-01-28T00:44:30.331464
64d766d8-85e7-3ecb-affc-475c0145e6d2,"Woman, 24, Says Big Sister Quit Job and Can't Pay Bills — Now Family Wants Her to Help Because She's Young. 'Can Always Save Again Later'",https://finance.yahoo.com/news/woman-24-says-big-sister-180107984.html,2026-01-26T18:01:07Z,yfinance,"Saving is hard enough when you're living at home, skipping dinners out, and quietly building a bank balance one boring weekend at a time. It's even harder when your older sister decides that since you've managed to be responsible, she's entitled to your money. A 24-year-old woman took to Reddit after her 29-year-old sister came to her asking for help covering bills. The younger sibling, still living with her parents, explained that she'd been saving for years to eventually move out—but the momen",,2026-01-28,RDDT,2026-01-28T00:44:30.331464
0f1069ad-f866-36bc-89ff-1ba240e14d34,"YouTube surpasses Reddit as primary social source for AI models, Adweek reports",https://tech.yahoo.com/social-media/articles/youtube-surpasses-reddit-primary-social-175808930.html,2026-01-26T17:58:08Z,yfinance,"Investing.com -- The hierarchy of social platform influence within artificial intelligence may be undergoing a significant shift as video content gains traction. According to Adweek, citing new data from four distinct sources, YouTube has officially eclipsed Reddit Inc (NYSE:RDDT) as the primary social citation source for large language models. This transition marks a notable reversal in how machines digest and reference human-generated information across the digital landscape. Historically, Red",,2026-01-28,RDDT,2026-01-28T00:44:30.331464
ca82f19f-6489-4a7c-b263-1ef3568fc88d,"Stock market today: S&P 500 hits fresh record with Fed decision, Big Tech earnings bonanza on deck",https://finance.yahoo.com/news/live/stock-market-today-sp-500-hits-fresh-record-with-fed-decision-big-tech-earnings-bonanza-on-deck-210311432.html,2026-01-27T21:03:11Z,yfinance,"Tech stocks are a bright spot as tariffs, healthcare names, and political insecurity weigh on investors.",,2026-01-28,AAPL,2026-01-28T00:44:30.331464
b35b12dd-940e-3ffa-ae75-1fde64eb1585,Wall Street Thinks This AI Stock Is the Next Big Thing,https://finance.yahoo.com/news/wall-street-thinks-ai-stock-000500769.html,2026-01-28T00:05:00Z,yfinance,"While AI chip stocks continue to garner outsize attention, smart analysts are looking elsewhere for growth.",,2026-01-28,AAPL,2026-01-28T00:44:30.331464
743ca737-749f-4e63-a5be-fff7f6f9ec3f,"Stock market today: Dow, S&P 500, Nasdaq futures edge up as Wall Street braces for Fed decision, Big Tech earnings",https://finance.yahoo.com/news/live/stock-market-today-dow-sp-500-nasdaq-futures-edge-up-as-wall-street-braces-for-fed-decision-big-tech-earnings-233353553.html,2026-01-27T23:33:53Z,yfinance,Wall Street is assessing the Federal Reserve and 'magnificent seven' earnings reports in a big week for data releases.,,2026-01-28,AAPL,2026-01-28T00:44:30.331464
b7ee55b7-b915-3b3a-9c85-9340d250f076,S&P 500 Posts a Record High on Tech Strength and Solid Corporate Earnings,https://finance.yahoo.com/news/p-500-posts-record-high-213436603.html,2026-01-27T21:34:36Z,yfinance,"The S&P 500 Index ($SPX ) (SPY ) on Tuesday closed up +0.41%, the Dow Jones Industrials Index ($DOWI ) (DIA ) closed down -0.83%, and the Nasdaq 100 Index ($IUXX ) (QQQ ) closed up +0.88%. March E-mini S&P futures (ESH26 ) rose +0.42%, and March E-mini Nasdaq futures...",,2026-01-28,AAPL,2026-01-28T00:44:30.331464
bfd23362-f219-374a-a5cb-007ffa82417d,"How major US stock indexes fared Tuesday, 1/27/2026",https://finance.yahoo.com/news/major-us-stock-indexes-fared-212650648.html,2026-01-27T21:26:50Z,yfinance,"Wall Street ticked to a record as stocks zigzagged underneath the market's surface following mixed profit reports from UnitedHealth, General Motors and other big companies. The S&P 500 rose 0.4% Tuesday, even though more stocks fell within the index than rose. It squeaked past its prior all-time high set a couple weeks ago.",,2026-01-28,AAPL,2026-01-28T00:44:30.331464
62ace358-1e4f-3d39-a85b-6194287df70e,Roche Shares Rise After Obesity Drug Shows 18% Greater Weight Loss,https://finance.yahoo.com/news/roche-shares-rise-obesity-drug-193530744.html,2026-01-27T19:35:30Z,yfinance,"Mid-stage trial data showed Roche's experimental shot delivered weight loss on par with leading obesity treatments, supporting its late-stage trial plans.",,2026-01-28,NVO,2026-01-28T00:44:30.331464
477a2d4d-fd33-33c7-8db1-6f3e26ac2479,1 Pharmaceutical Stock Set to Rebound in 2026,https://finance.yahoo.com/news/1-pharmaceutical-stock-set-rebound-180000004.html,2026-01-27T18:00:00Z,yfinance,Novo Nordisk stock will ride a wave of demand for Ozempic pills in 2026.,,2026-01-28,NVO,2026-01-28T00:44:30.331464
4ca2441d-cbbf-3636-a8e4-18c125907171,Citi initiates coverage of European pharma stocks; AstraZeneca ‘best in class’,https://finance.yahoo.com/news/citi-initiates-coverage-european-pharma-161653376.html,2026-01-27T16:16:53Z,yfinance,"Investing.com -- Citi launched broad coverage of major European pharmaceutical companies with a mixed outlook, issuing Buy ratings on AstraZeneca and Novartis while taking a more cautious stance on GSK, Novo Nordisk and Sanofi.",,2026-01-28,NVO,2026-01-28T00:44:30.331464
4a41ae03-1bf8-3d88-a6eb-195ad5ff347f,2 Pharmaceutical Stocks Set to Rebound in 2026,https://finance.yahoo.com/news/2-pharmaceutical-stocks-set-rebound-153700311.html,2026-01-27T15:37:00Z,yfinance,There might be massive upside ahead for these drugmakers.,,2026-01-28,NVO,2026-01-28T00:44:30.331464
5be3783a-d1b0-3ca2-8168-9b1072d72774,Novo Nordisk vs. Viking: Which Obesity Drug Stock is the Safer Bet?,https://finance.yahoo.com/news/novo-nordisk-vs-viking-obesity-144100886.html,2026-01-27T14:41:00Z,yfinance,"NVO and VKTX face rising competition and setbacks as investors weigh scale, pipelines and execution risks in the crowded obesity drug race.",,2026-01-28,NVO,2026-01-28T00:44:30.331464
2963474c-e1de-3b97-9441-ab69674c65e1,"Roche, trailing in obesity, showcases new data for GLP-1 shot",https://finance.yahoo.com/news/roche-trailing-obesity-showcases-data-113100723.html,2026-01-27T11:31:00Z,yfinance,"A drug Roche acquired in a multibillion-dollar deal could be as effective as Zepbound, but may struggle to stand out in a crowded field, analysts said.",,2026-01-28,NVO,2026-01-28T00:44:30.331464
b002abb0-834e-3de3-984b-bad601505640,Trump Media announces February 2 record date for digital token initiative,https://finance.yahoo.com/news/trump-media-announces-february-2-134529024.html,2026-01-21T13:45:29Z,yfinance,"Trump Media (DJT) and Technology Group announced the record date for its recently-announced digital token initiative will be February 2, 2026. Ultimate beneficial owners and registered holders of at least one whole share of DJT stock as of the record date will be eligible to receive tokens and associated incentives. While Trump Media will actively seek information for all eligible holders from broker participants, designation as an objecting beneficial owner may delay or inhibit timely informati",,2026-01-28,DJT,2026-01-28T00:44:30.331464
34db7eaa-af89-3731-b413-56e2b514a986,How Investors May Respond To Trump Media & Technology Group (DJT) Launching Truth Social–Branded SMA Strategies,https://finance.yahoo.com/news/investors-may-respond-trump-media-031852744.html,2026-01-17T03:18:52Z,yfinance,"In early January 2026, Trump Media & Technology Group announced four Truth Social–branded Separately Managed Account investment strategies, seeded with its own capital and focused on themes such as industrial growth, national security, Christian values, and essential infrastructure. This move signals an expansion of Trump Media’s business beyond social media into values-based financial products that aim to attract like-minded investors. Next, we’ll examine how Trump Media’s push into...",,2026-01-28,DJT,2026-01-28T00:44:30.331464
3d71a69d-0014-32e0-9611-59925abc3451,DJT Is Not a Media Stock: A Different Way to Think About Its Value,https://finance.yahoo.com/news/djt-not-media-stock-different-122837712.html,2026-01-08T12:28:37Z,yfinance,"Why optionality, dilution, and capital allocation matter more than revenue",,2026-01-28,DJT,2026-01-28T00:44:30.331464
974bfa92-0818-3443-b67e-32690488fa92,Tyson Foods (TSN) Expected to Beat Earnings Estimates: What to Know Ahead of Q1 Release,https://finance.yahoo.com/news/tyson-foods-tsn-expected-beat-150003650.html,2026-01-26T15:00:03Z,yfinance,Tyson (TSN) possesses the right combination of the two key ingredients for a likely earnings beat in its upcoming report. Get prepared with the key expectations.,,2026-01-28,TSN,2026-01-28T00:44:30.331464
fcf80357-99b2-3e46-bc25-6806ef4bd098,How New Price Targets Are Reframing The Story For Tyson Foods (TSN),https://finance.yahoo.com/news/price-targets-reframing-story-tyson-190726498.html,2026-01-23T19:07:26Z,yfinance,"The recent change in Tyson Foods’ price target has put fresh attention on how investors are thinking about the company and its prospects. With this new target now setting the tone for expectations around the stock, it reflects a reassessment of the risks and opportunities that analysts see ahead. Stay tuned to see how you can keep on top of these shifting targets and the story they tell about Tyson Foods in the months to come. Analyst Price Targets don't always capture the full story. Head...",,2026-01-28,TSN,2026-01-28T00:44:30.331464
f879b91d-fefc-35f7-bea3-d4d65e980413,Want Better Returns? Don't Ignore These 2 Consumer Staples Stocks Set to Beat Earnings,https://finance.yahoo.com/news/want-better-returns-dont-ignore-140003167.html,2026-01-23T14:00:03Z,yfinance,Investors looking for ways to find stocks that are set to beat quarterly earnings estimates should check out the Zacks Earnings ESP.,,2026-01-28,TSN,2026-01-28T00:44:30.331464
153adf19-2c09-30ed-898b-313b96d41ced,Sysco Set to Report Q2 Earnings: Here's What to Expect From SYY,https://finance.yahoo.com/news/sysco-set-report-q2-earnings-120800648.html,2026-01-23T12:08:00Z,yfinance,"SYY is set for Q2 earnings growth as U.S. Foodservice volumes improve, margins expand and productivity gains support higher profits.",,2026-01-28,TSN,2026-01-28T00:44:30.331464
12cecc23-8a04-3535-82a1-fa55594c9af7,Kimberly-Clark's Q4 Earnings Coming Up: What Investors Need to Know,https://finance.yahoo.com/news/kimberly-clarks-q4-earnings-coming-115900347.html,2026-01-23T11:59:00Z,yfinance,"KMB heads into Q4 earnings with expected revenue and EPS declines, pressured by promotions, tariffs and FX, even as core demand and productivity hold up.",,2026-01-28,TSN,2026-01-28T00:44:30.331464
05a1dadf-0cab-3f58-9c0a-5b44a37c5787,3 Unpopular Stocks We Keep Off Our Radar,https://finance.yahoo.com/news/3-unpopular-stocks-keep-off-043429509.html,2026-01-23T04:34:29Z,yfinance,Wall Street’s bearish price targets for the stocks in this article signal serious concerns. Such forecasts are uncommon in an industry where maintaining cordial corporate relationships often trumps delivering the hard truth.,,2026-01-28,TSN,2026-01-28T00:44:30.331464
88c349a9-186b-37e7-ba33-224c737246db,Tyson Foods (TSN) Exceeds Market Returns: Some Facts to Consider,https://finance.yahoo.com/news/tyson-foods-tsn-exceeds-market-230005669.html,2026-01-22T23:00:05Z,yfinance,"In the most recent trading session, Tyson Foods (TSN) closed at $61.12, indicating a +1.88% shift from the previous trading day.",,2026-01-28,TSN,2026-01-28T00:44:30.331464
74199bd5-608b-30e0-8c8d-ea70b9005828,3 AgTech & Food Innovation Stocks With Long-Term Growth Exposure,https://finance.yahoo.com/news/3-agtech-food-innovation-stocks-140400739.html,2026-01-22T14:04:00Z,yfinance,"AgTech & Food Innovation sharpens focus as Corteva, Beyond Meat and Ingredion Incorporated drive progress in seeds, protein innovation and clean-label ingredients.",,2026-01-28,TSN,2026-01-28T00:44:30.331464
b26c53f7-f207-3bae-930a-8e5085ac46b5,"Here is What to Know Beyond Why Tyson Foods, Inc. (TSN) is a Trending Stock",https://finance.yahoo.com/news/know-beyond-why-tyson-foods-140003126.html,2026-01-22T14:00:03Z,yfinance,"Tyson (TSN) has been one of the stocks most watched by Zacks.com users lately. So, it is worth exploring what lies ahead for the stock.",,2026-01-28,TSN,2026-01-28T00:44:30.331464
68cfdc40-7abe-3f7d-b22c-b279a63ce92b,Tyson Foods (TSN) Gains As Market Dips: What You Should Know,https://finance.yahoo.com/news/tyson-foods-tsn-gains-market-231503162.html,2026-01-20T23:15:03Z,yfinance,"In the closing of the recent trading day, Tyson Foods (TSN) stood at $60.9, denoting a +1.38% move from the preceding trading day.",,2026-01-28,TSN,2026-01-28T00:44:30.331464
eaada30c-8b73-4bd4-9bc6-3077a45faaec,Chip sector shifts: Nvidia to beat Apple as TSMC's top customer,https://finance.yahoo.com/video/chip-sector-shifts-nvidia-to-beat-apple-as-tsmcs-top-customer-212618311.html,2026-01-27T21:26:18Z,yfinance,"Nvidia (NVDA) is set to surpass Apple (AAPL) as Taiwan Semiconductor Manufacturing Company's (TSM) top 2026 customer.Creative Strategies CEO and principal analyst Ben Bajarin joins Market Domination host Josh Lipton to explain how the chip sector is evolving.To watch more expert insights and analysis on the latest market action, check out more Market Domination.",,2026-01-28,NVDA,2026-01-28T00:44:30.331464
090c1a21-a36f-4758-a447-c20a5ced5b3b,Why Nvidia stock is on sale,https://finance.yahoo.com/news/why-nvidia-stock-is-on-sale-161506921.html,2026-01-27T16:15:06Z,yfinance,Time to nibble at Nvidia?,,2026-01-28,NVDA,2026-01-28T00:44:30.331464
7c86721c-f52f-3a8e-86da-0a9943fb3eb0,Starbucks Files CEO Pay Drop as Turnaround Takes Shape,https://finance.yahoo.com/news/starbucks-files-ceo-pay-drop-181018145.html,2026-01-27T18:10:18Z,yfinance,Brian Niccol's fiscal 2025 compensation fell to $31 million as shares declined and performance-based awards were limited.,,2026-01-28,CMG,2026-01-28T00:44:30.331464
ffd5cf11-188c-31d3-8ca6-ca39a4e46488,Earnings Preview: Chipotle Mexican Grill (CMG) Q4 Earnings Expected to Decline,https://finance.yahoo.com/news/earnings-preview-chipotle-mexican-grill-150007670.html,2026-01-27T15:00:07Z,yfinance,Chipotle (CMG) doesn't possess the right combination of the two key ingredients for a likely earnings beat in its upcoming report. Get prepared with the key expectations.,,2026-01-28,CMG,2026-01-28T00:44:30.331464
d83fc43f-6687-3017-b0b8-49197a53b564,Chipotle bets Chicken al Pastor will bring consumers back,https://finance.yahoo.com/news/chipotle-bets-chicken-al-pastor-100431151.html,2026-01-27T10:04:31Z,yfinance,"The fast casual giant is increasing the frequency of its protein LTOs in a bid to drive trial, relevance and traffic.",,2026-01-28,CMG,2026-01-28T00:44:30.331464
b82b20e5-0f9a-32f0-ba2d-908e3a2179d8,Starbucks CEO Brian Niccol Earned $31 Million in 2025,https://finance.yahoo.com/news/starbucks-ceo-brian-niccol-earned-014214649.html,2026-01-27T01:42:14Z,yfinance,"Niccol’s 2025 pay includes a $5 million bonus and nearly $20 million in stock awards, according to a filing from the coffee chain on Monday.  The stock awards will be based in part on company performance.",,2026-01-28,CMG,2026-01-28T00:44:30.331464
731bcd8c-3ecc-3126-8047-78ff9e430a8e,Chipotle Mexican Grill (CMG) Stock Sinks As Market Gains: Here's Why,https://finance.yahoo.com/news/chipotle-mexican-grill-cmg-stock-224503307.html,2026-01-26T22:45:03Z,yfinance,"Chipotle Mexican Grill (CMG) closed at $39.72 in the latest trading session, marking a -2.81% move from the prior day.",,2026-01-28,CMG,2026-01-28T00:44:30.331464
6240519b-b2fd-32cf-a52f-69ae25eedeea,Chipotle’s new CMO on how the brand’s latest ad meets consumer trends,https://finance.yahoo.com/news/chipotle-cmo-brand-latest-ad-100000957.html,2026-01-26T10:00:00Z,yfinance,“Choices” contrasts daily prep at the fast-casual Mexican chain with images of nuggets in fryer baskets and frozen burger patties on a conveyor belt.,,2026-01-28,CMG,2026-01-28T00:44:30.331464
08b696b6-c488-3c52-a95e-117d315490f4,Should You Buy Chipotle Stock While It's Below $45?,https://finance.yahoo.com/news/buy-chipotle-stock-while-below-141500052.html,2026-01-25T14:15:00Z,yfinance,Chipotle shares are trading 41% off their record high.,,2026-01-28,CMG,2026-01-28T00:44:30.331464
085c6ba5-f6d5-3a47-9cfb-8e284805bc2e,Chipotle Mexican Grill Inc. (CMG) Builds Momentum Through Expansion and Strong Unit Growth,https://finance.yahoo.com/news/chipotle-mexican-grill-inc-cmg-044208849.html,2026-01-25T04:42:08Z,yfinance,"Chipotle Mexican Grill Inc. (NYSE:CMG) is one of the best stocks to buy, according to billionaire Bill Ackman. On January 5, TD Cowen touted Chipotle Mexican Grill Inc. (NYSE:CMG)’s first quarter and full year 2026 same-store sales estimates, insisting they are achievable based on current projections. Consequently, the research firm raised its price target to […]",,2026-01-28,CMG,2026-01-28T00:44:30.331464
d774d196-e15c-335e-a813-28870557334e,Sweetgreen Stock: Can a Popular Brand Translate Into Durable Shareholder Returns?​,https://finance.yahoo.com/news/sweetgreen-stock-popular-brand-translate-171000191.html,2026-01-24T17:10:00Z,yfinance,"Sweetgreen stock is down big, but investors may ponder whether it's a buying opportunity or a sign to avoid the stock.",,2026-01-28,CMG,2026-01-28T00:44:30.331464
ad3a183f-ac93-3d96-9094-14ba77225877,Is Chipotle (CMG) Pricing Reflect Its Brand Strength And Recent Share Price Pullback,https://finance.yahoo.com/news/chipotle-cmg-pricing-reflect-brand-061010415.html,2026-01-24T06:10:10Z,yfinance,"If you are wondering whether Chipotle Mexican Grill stock still lines up with its current price, this article walks through what the numbers suggest about value and what that might mean for you. The share price most recently closed at US$40.87, with returns of 2.3% over 7 days, 7.8% over 30 days, 9.0% year to date, and a 27.9% decline over the last year, alongside returns of 26.6% over 3 years and 38.1% over 5 years. Recent news around Chipotle has largely focused on the business as a well...",,2026-01-28,CMG,2026-01-28T00:44:30.331464
1afa563a-f7bb-4fac-a7f7-f4ec3e1ba65d,"Mag 7 earnings, Fed's interest rate decision: What to Watch",https://finance.yahoo.com/video/mag-7-earnings-feds-interest-rate-decision-what-to-watch-000000492.html,2026-01-28T00:00:00Z,yfinance,"Market Domination Overtime Host Josh Lipton previews several of the biggest stories to come tomorrow,&nbsp;including the Federal Reserve's latest decision on interest rates and earnings results from Magnificent Seven tech companies like Microsoft (MSFT), Meta Platforms (META), and Tesla (TSLA).To watch more expert insights and analysis on the latest market action, check out more&nbsp;Market Domination Overtime.",,2026-01-28,TSLA,2026-01-28T00:44:30.331464
9fca3038-496d-4868-afee-80726bfbc1bc,Tech earnings: AI spending moderation could prove detrimental,https://finance.yahoo.com/video/tech-earnings-ai-spending-moderation-could-prove-detrimental-205430937.html,2026-01-27T20:54:30Z,yfinance,"Earnings season is off to another busy week as Magnificent Seven companies prepare to release quarterly earnings results: Microsoft (MSFT), Meta Platforms (META), and Tesla (TSLA) coming out on Wednesday, and Apple (AAPL) on Thursday.The S&P 500 (^GSPC) inches closer to a record milestone of 7,000 amid investor anticipation.Washington Crossing Advisors Senior Portfolio Manager Chad Morganlander comes on Market Domination to talk more about the ROIC figures (Return on Invested Capital) that he expects to see from the AI hyperscalers this week.To watch more expert insights and analysis on the latest market action, check out more&nbsp;Market Domination.",,2026-01-28,TSLA,2026-01-28T00:44:30.331464
